id,name,sku,barcode,price,manufacturer,category,image_url,seo_url_en
34201,"La Roche-Posay Innovation Anthelios UVMune 400 Oil Control Fluid Sunscreen SPF 50+ - 50ml","C-03.145","3337875847292",155.00,"La Roche-Posay","Care > Sun Care > Sunscreen","images/34201_0.jpg","-n34201"
37346,"La-Roche-Posay Innovation Anthelios UVMune 400 Anti-dark spots SPF50+ - 50ml","D-03.211","3337875917407",185.00,"La Roche-Posay","Care > Sun Care > Sunscreen","images/37346_0.jpg","-n37346"
21596,"Bioderma Photoderm Cream SPF 50+ Sunscreen Clear - 40ml","D1-04.023","3701129803523",149.00,"Bioderma","Care > Sun Care > Sunscreen","images/21596_0.png","-n21596"
30581,"Filorga Anti-Aging & Dark Spots Fluid Uv Bronze SPF50+ - 40 ml","D1-10.153","3401360245761",208.00,"Filorga","Care > Sun Care > Sunscreen","images/30581_0.png","-n30581"
35784,"Skin1004 Madagascar Centella Hyalu-Cica Silky-Fit Sun Stick SPF50+ - 7gm","D-10.166","8809913830283",103.50,"SKIN1004","Care > Sun Care > Sunscreen","images/35784_0.png","-n35784"
24741,"BEAUTY OF JOSEON Matte Sun Stick Mugwort+Camelia SPF 50+ (PA++++) - 18gm","D-08.032","8809864766884",75.00,"BEAUTY OF JOSEON","Care > Sun Care > Sunscreen","images/24741_0.png","-n24741"
35162,"Bioderma Photoderm XDefense Ultra Fluid SPF50+ - 03 - 40ml","D1-17.242","3701129813645",168.00,"Bioderma","Care > Sun Care > Sunscreen","images/35162_0.png","-n35162"
9149,"Uriage Hyseac Fluide Sunscreen SPF 50 - 50ml","D-09.087","3661434001932",164.00,"Uriage","Care > Sun Care > Sunscreen","images/9149_0.png","-n9149"
30400,"BEAUTY OF JOSEON Relief Sun Aqua-Fresh Rice + B5 SPF50+ (PA++++) - 50ml","D-07.073","8809968130277",78.00,"BEAUTY OF JOSEON","Care > Sun Care > Sunscreen","images/30400_0.png","-n30400"
30580,"Filorga Anti-Aging & Dark Spots Uv Defence SPF50+ - 40 ml","D1-10.154","3401360202337",290.00,"Filorga","Care > Sun Care > Sunscreen","images/30580_0.png","-n30580"
30565,"SVR Sun Secure Cream SPF +50 - 50 ml","D1-18.274","3662361001705",138.00,"SVR","Care > Sun Care > Sunscreen","images/30565_0.png","-n30565"
28033,"Shiseido Sun Protection Essential SPF50+ Set","D1-07.062","3423222094904",239.00,"Shiseido","Care > Sun Care > Sunscreen","images/28033_0.png","-n28033"
34200,"La Roche-Posay Cicaplast Balm B5+ SPF 50 - 40ml","D-08.123","3337875876940",120.00,"La Roche-Posay","Care > Sun Care > Sunscreen","images/34200_0.jpg","-n34200"
11345,"La Roche-Posay Innovation Anthelios UVmune 400 50+ SPF Oil Control - 50ml","D-07.025","3337875546430",155.00,"La Roche-Posay","Care > Sun Care > Sunscreen","images/11345_0.png","-n11345"
30736,"Pharmaceris S Sensi Daily Sun Protection Lotion SPF 50+  - 50ml","D1-12.213","5900717491113",150.00,"Pharmaceris","Care > Sun Care > Sunscreen","images/30736_0.png","-n30736"
25906,"Tocobo Cotton Soft Sun Stick SPF50+ (PA++++)","C-05.215","8809835060041",155.00,"Tocobo","Care > Sun Care > Sunscreen","images/25906_0.png","-n25906"
30498,"Anivagene Sun Care SPF 50 - 50 ml","D-11.225","5200415201411",126.00,"Anivagene","Care > Sun Care > Sunscreen","images/30498_0.png","-n30498"
34937,"Jumiso Waterfull Hyaluronic Sun screen - 50ml","D1-11.204","8809655950331",149.50,"Jumiso","Care > Sun Care > Sunscreen","images/34937_0.png","-n34937"
26634,"Numbuzin No.1 Clear Filter Sun Essence SPF50+ - 50 ML","D-08.051","8691266759773,8809652581705",93.00,"Numbuzin","Care > Sun Care > Sunscreen","images/26634_0.png","-n26634"
27334,"Garnier SkinActive Super UV Invisible Serum Sunscreen - 30ml","D-17.211","8994993025626",39.00,"Garnier","Care > Sun Care > Sunscreen","images/27334_0.jpg","-n27334"
24622,"Isis Pharma Neotone Radiance SPF50+ - 30ml","D1-10.020","3401575243675",299.00,"ISIS PHARMA","Care > Sun Care > Sunscreen","images/24622_0.png","-n24622"
22268,"Nacific Fresh Herb Origin Sunblock - 50ml","D1-12.108","8809517461050",95.00,"Nacific","Care > Sun Care > Sunscreen","images/22268_0.png","-n22268"
22454,"Cosrx Aloe Soothing Sun Cream Spf 50+  - 50ml","D-16.045","8809416470191",79.00,"COSRX","Care > Sun Care > Sunscreen","images/22454_0.png","-n22454"
24927,"BEAUTY OF JOSEON Ginseng Moist Sun Serum SPF50 - 50ml","D-07.182","8809864752689",67.00,"BEAUTY OF JOSEON","Care > Sun Care > Sunscreen","images/24927_0.png","-n24927"
26378,"ISNTREE Hyaluronic Acid Watery Sun Gel SPF50+ - 50ml","D-07.113","8809686384204",88.00,"Isntree","Care > Sun Care > Sunscreen","images/26378_0.png","-n26378"
30415,"I'm from Rice Sunscreen - 50ml","D-12.211","8809525931590",109.00,"I'm From","Care > Sun Care > Sunscreen","images/30415_0.png","-n30415"
28444,"Fenty Skin Hydra Vizor SPF30 Sunscreen Moisturiser - 50ml","D1-18.054","840026663472",205.00,"FENTY SKIN","Care > Sun Care > Sunscreen","images/28444_0.png","-n28444"
29092,"Beauty of Joseon Sun Trio Sunscreen Skin Care Set - 3 Pieces","D1-13.078","8809864758636",199.00,"BEAUTY OF JOSEON","Care > Sun Care > Sunscreen","images/29092_0.png","-n29092"
30459,"Uriage Bariésun Spray Moisturizing Kid Spray Very High Protection SPF50+ - 200ml","C-04.126","3661434008399",195.00,"Uriage","Care > Sun Care > Sunscreen","images/30459_0.png","-n30459"
14948,"Vaseline Daily Sun Cream - 50 ml","D1-12.034","8801619048481",71.00,"Vaseline","Care > Sun Care > Sunscreen","images/14948_0.png","-n14948"
21879,"Vanessium Natural Sunscreen Cream SPF50+ - 50ml","D1-12.014","8437024160168",129.00,"VANESSIUM","Care > Sun Care > Sunscreen","images/21879_0.png","-n21879"
30734,"Pharmaceris S Cica Intensive After Sun - 200 ml","D1-12.124","5900717149144",132.00,"Pharmaceris","Care > Sun Care > Sunscreen","images/30734_0.png","-n30734"
30481,"ISIS Pharma Uveblock SPF50+ Very High Protection Spray - 200 ml","D-11.232","3760269770294",192.00,"ISIS PHARMA","Care > Sun Care > Sunscreen","images/30481_0.png","-n30481"
25905,"Tocobo Bio Watery Sun Cream SPF50+ (PA++++) - 50 ml","D1-12.087","8809835060058",155.00,"Tocobo","Care > Sun Care > Sunscreen","images/25905_0.png","-n25905"
26377,"Round Lab Birch Juice Moisturizing Sunscreen SPF50+ - 50ml","D-10.265","8809782551814,8809782551463",94.00,"ROUND LAB","Care > Sun Care > Sunscreen","images/26377_0.png","-n26377"
26278,"La Roche-Posay Mela B3 UV Daily Sunscreen SPF 30 - 40ml","D1-11.018","3337875890113",225.00,"La Roche-Posay","Care > Sun Care > Sunscreen","images/26278_0.png","-n26278"
14675,"Eveline Whitening Sun Protection Face Cream - 50 ml","D-09.107","5907609380906",75.00,"Eveline Cosmetics","Care > Sun Care > Sunscreen","images/14675_0.png","-n14675"
23158,"Uriage Depiderm SPF 50+ Anti-Taches - 30ml","D1-17.151","3661434004384,3661434000942,3661434009778",245.00,"Uriage","Care > Sun Care > Sunscreen","images/23158_0.png","-n23158"
26911,"Cosrx Ultra-Light Invisible Sunscreen SPF50 PA++++ - 50ml","D-04.155","8809598456242",75.00,"COSRX","Care > Sun Care > Sunscreen","images/26911_0.png","-n26911"
26455,"HaruHaru Wonder Black Rice Pure Mineral Relief Daily Sunscreen SPF50+ - 50ml","D-10.135","8809532221691",79.00,"HaruHaru Wonder","Care > Sun Care > Sunscreen","images/26455_0.png","-n26455"
27959,"Uriage Bariésun Moisturising Dry Mist SPF50+ - 200ml","D1-10.104","3661434006500",164.00,"Uriage","Care > Sun Care > Sunscreen","images/27959_0.png","-n27959"
26453,"HaruHaru Wonder Black Rice Moisture Airyfit Daily Sunscreen SPF50+ - 50ml","D-10.261","8809532221707",73.00,"HaruHaru Wonder","Care > Sun Care > Sunscreen","images/26453_0.png","-n26453"
27893,"Isispharma Uveblock SPF50+ Spray for Kids - 200ml","D1-07.066","3760269770300",192.00,"ISIS PHARMA","Care > Sun Care > Sunscreen","images/27893_0.png","-n27893"
27879,"Pharmaceris Sebo-Moistatic Moisturing and Soothing Face Cream SPF 30 - 50ml","D1-11.125","5900717142619",163.00,"Pharmaceris","Care > Sun Care > Sunscreen","images/27879_0.png","-n27879"
21369,"Eveline Sun Protection Face Cream SPF50 - 50ml","D1-02.001","5907609330789",75.00,"Eveline Cosmetics","Care > Sun Care > Sunscreen","images/21369_0.png","-n21369"
27925,"Isispharma Fluid Sunscreen Dry Touch SPF50+ - 40 ml","C-04.077","3760269770508",146.00,"ISIS PHARMA","Care > Sun Care > Sunscreen","images/27925_0.png","-n27925"
9828,"Avene Sunscreen Fluid SPF 50 - 50ml","D1-11.172","3282770149128,3282770112702",174.00,"Avene","Care > Sun Care > Sunscreen","images/9828_0.png","-n9828"
25628,"Anua Heartleaf Silky Moisture Sunscreen with SPF 50+ - 50ml","D-11.150","8809640733185",119.99,"Anua","Care > Sun Care > Sunscreen","images/25628_0.png","-n25628"
26096,"AXIS-Y Complete No-Stress Physical Sunscreen V3 - 50 ml","D-13.195","8809634610119",89.00,"Axis-Y","Care > Sun Care > Sunscreen","images/26096_0.png","-n26096"
23528,"BEAUTY OF JOSEON Relief Sun Rice + Probiotics SPF50+ (PA++++) - 50ml","AA-01.025","8809782555508",69.00,"BEAUTY OF JOSEON","Care > Sun Care > Sunscreen","images/23528_0.png","-n23528"
35793,"Skin1004 Madagascar Centella Hyalu-Cica Water-Fit Sun Serum SPF50+ Twin Pack - 50mlx2","D-03.282","8809913830122",185.15,"SKIN1004","Care > Sun Care > Sunscreen","images/35793_0.png","-n35793"
26655,"Skin1004 Madagascar Centella Air-Fit Suncream Plus SPF50+ - 50 ml","D-02.096","8809576261301",89.00,"SKIN1004","Care > Sun Care > Sunscreen","images/26655_0.png","-n26655"
30764,"Lysaskin Ecran Solaire Sunscreen SPF 50+ - 40 ml","D1-08.191","3760100590210",79.00,"Lysaskin","Care > Sun Care > Sunscreen","images/30764_0.png","-n30764"
19733,"La Roche-Posay Anthelios UVmune 400 Cream SPF50+ - 50ml","D-14.181","3337875797719",155.00,"La Roche-Posay","Care > Sun Care > Sunscreen","images/19733_0.png","-n19733"
20139,"Laser White Collagen Whitening Sunscreen Cream UV 60+ - 100 g","D-01.104","8859362510113",99.00,"Laser White","Care > Sun Care > Sunscreen","images/20139_0.png","-n20139"
19734,"La Roche-Posay Anthelios Uvmune 400 Invisible Fluid SPF50+ - 50ml","D-16.173","3337875797580,3337875797597",155.00,"La Roche-Posay","Care > Sun Care > Sunscreen","images/19734_0.jpg","-n19734"
35783,"Skin1004 Madagascar Centella Probio-Cica Glow Sun Ampoule SPF50+ - 50ml","D-10.163","8809913830573",126.50,"SKIN1004","Care > Sun Care > Sunscreen","images/35783_0.png","-n35783"
23896,"Some By Mi Truecica Aqua Calming Sun Cream - 50ml","D-16.128","8809647391951",97.99,"Some By MI","Care > Sun Care > Sunscreen","images/23896_0.png","-n23896"
35785,"Skin1004 Madagascar Centella Hyalu-Cica Silky-Fit Sun Stick SPF50+ - 20gm","D1-17.136","8809913830214",119.60,"SKIN1004","Care > Sun Care > Sunscreen","images/35785_0.png","-n35785"
35164,"Bioderma Photoderm XDefense Ultra Fluid SPF50+ - 01 - 40ml","D1-17.244","3701129813621",168.00,"Bioderma","Care > Sun Care > Sunscreen","images/35164_0.png","-n35164"
24906,"Guanjing Beauty Kojic Acid Sunscreen Cream SPF50+ - 80g","D-10.253","6932511228625,6932511236972",28.00,"Guanjing Beauty","Care > Sun Care > Sunscreen","images/24906_0.png","-n24906"
35801,"Skin1004 Madagascar Centella Air-Fit Suncream Light SPF30+ - 50ml","D-10.184","8809576261608",132.25,"SKIN1004","Care > Sun Care > Sunscreen","images/35801_0.png","-n35801"
35163,"Bioderma Photoderm XDefense Ultra Fluid SPF50+ - 02 - 40ml","D1-17.243","3701129813638",168.00,"Bioderma","Care > Sun Care > Sunscreen","images/35163_0.png","-n35163"
35782,"Skin1004 Madagascar Centella Hyalu-Cica Water-Fit Sun Serum SPF50+ - 100ml","D-03.275","8809913830603",125.35,"SKIN1004","Care > Sun Care > Sunscreen","images/35782_0.png","-n35782"
19114,"Beesline Age Defense Tinted Facial Fluid Sunscreen SPF 50+ - 40ml","D-15.253","5281018089071",145.00,"Beesline","Care > Sun Care > Sunscreen","images/19114_0.png","-n19114"
20392,"ACM Medisun SPF 50+ Spray - 200ml","D1-11.132","3760095253657",199.00,"ACM","Care > Sun Care > Sunscreen","images/20392_0.png","-n20392"
17350,"Some By Mi Truecica Mineral Calming Tone-Up Suncream SPF 50+ - 50ml","D-07.059","8809647390206,8809647391609",60.99,"Some By MI","Care > Sun Care > Sunscreen","images/17350_0.png","-n17350"
13874,"Vichy 50+SPF Capital Soleil Velvety Protective Cream - 50ml","C-06.181","3337871324445",180.00,"Vichy","Care > Sun Care > Sunscreen","images/13874_0.png","-n13874"
27287,"Tocobo Cica Calming Sun Serum SPF50+ (PA++++) - 50 ml","D1-14.054","8809835060447",161.00,"Tocobo","Care > Sun Care > Sunscreen","images/27287_0.png","-n27287"
27512,"Topface Sun Protect Anti Shine 50+ Spf - 50ml","D-13.268","8681217252967",49.00,"Topface","Care > Sun Care > Sunscreen","images/27512_0.png","-n27512"
7490,"Cetaphil Sun Very High Protection Light Gel SPF 50+ - 50ml","D-17.132","7612076368293",132.25,"Cetaphil","Care > Sun Care > Sunscreen","images/7490_0.png","-n7490"
35781,"Skin1004 Madagascar Centella Tea-Trica Soothing Sun Milk SPF50+ - 50ml","D-10.160","8809913830610",78.20,"SKIN1004","Care > Sun Care > Sunscreen","images/35781_0.png","-n35781"
15119,"La Roche-Posay Anthelios UVmune 400 Tinted 50+ SPF Oil Control - 50ml","D-12.110","3337875545891",159.00,"La Roche-Posay","Care > Sun Care > Sunscreen","images/15119_0.png","-n15119"
24961,"Skin1004 Madagascar Centella Hyalu-Cica Water-Fit Sun Serum SPF50+ - 50ml","D-08.165","8809576261592",105.00,"SKIN1004","Care > Sun Care > Sunscreen","images/24961_0.png","-n24961"
30039,"La Roche-Posay Anthelios Transparent Sunscreen Spray SPF 50 - 2 piece","D-08.017","6294016184104,6294016996806",135.00,"La Roche-Posay","Care > Sun Care > Sunscreen","images/30039_0.png","-n30039"
35165,"Bioderma Photoderm XDefense Ultra Fluid SPF50+ - Invisible - 40ml","D-10.156","3701129813614",168.00,"Bioderma","Care > Sun Care > Sunscreen","images/35165_0.png","-n35165"
26379,"ISNTREE Hyaluronic Acid Natural Sun Cream SPF50+ - 50ml","D-07.118","8809782554464,8809800941672",139.00,"Isntree","Care > Sun Care > Sunscreen","images/26379_0.png","-n26379"
35794,"Skin1004 Madagascar Centella Hyalu-Cica Water-Fit Sun Serum SPF50+ - 15ml","D-08.078","8809913830061",33.35,"SKIN1004","Care > Sun Care > Sunscreen","images/35794_0.png","-n35794"
9068,"Qv Face Gentle Foaming Cleanser - 150ml","D-03.170","9314839015410,9314839023910",77.00,"QV","Care > Sun Care > Sunscreen","images/9068_0.png","-n9068"
21911,"Vanessium Gel Cream SPF50 - 50ml","D1-12.088","8437024160090",115.00,"VANESSIUM","Care > Sun Care > Sunscreen","images/21911_0.png","-n21911"
35161,"Bioderma Photoderm XDefense Ultra Fluid SPF50+ - 04 - 40ml","D1-17.241","3701129813652",168.00,"Bioderma","Care > Sun Care > Sunscreen","images/35161_0.png","-n35161"
17149,"Childs Farm 50+ SPF Sun Cream - 125ml","D1-12.116","5060447940517",135.92,"Childs Farm","Care > Sun Care > Sunscreen","images/17149_0.png","-n17149"
21906,"Vanessium Sport Sunscreen Cream SPF50+ - 50ml","D1-17.176","8437024160045",85.00,"VANESSIUM","Care > Sun Care > Sunscreen","images/21906_0.png","-n21906"
133,"Now European Clay Powder - 170g","D-01.080","733739147820,733739081506",37.95,"now","Care > Sun Care > Sunscreen","images/133_0.png","-n133"
27418,"Carbon Theory Day-Lite Sunscreen SPF 50+ - 50ml","D1-07.168","634114071955",125.00,"Carbon Theory","Care > Sun Care > Sunscreen","images/27418_0.png","-n27418"
30285,"RoC Multi Correxion Hydrate + Plump Moisturiser SPF30 - 50ml","D1-06.139","1210000800299",238.00,"RoC","Care > Sun Care > Sunscreen","images/30285_0.png","-n30285"
30301,"RoC Soleil-Protect Moisturising Spray Lotion SPF50 - 200ml","D1-06.131","1210000800206",193.00,"RoC","Care > Sun Care > Sunscreen","images/30301_0.png","-n30301"
30300,"RoC Soleil-Protect Anti-Wrinkle Smoothing Fluid SPF 50 - 50ml","D1-06.132","1210000800077",157.00,"RoC","Care > Sun Care > Sunscreen","images/30300_0.png","-n30300"
15061,"Vaseline 50SPF UV Protection Sun Stick - 15g","D-13.015","8801619048504",64.00,"Vaseline","Care > Sun Care > Sunscreen","images/15061_0.png","-n15061"
27071,"KAHI Aqua Balm with SPF50+ - 9gm","D1-11.147","8809738603550",108.00,"KAHI","Care > Sun Care > Sunscreen","images/27071_0.png","-n27071"
33554,"Vanessium Facial Exfoliation - 50 ml","D1-18.023","8437024160281",178.25,"VANESSIUM","Care > Sun Care > Sunscreen","images/33554_0.png","-n33554"
33555,"Vanessium Cellucare Cream SPF30 - 100 ml","D1-18.022","8437024160250",241.50,"VANESSIUM","Care > Sun Care > Sunscreen","images/33555_0.png","-n33555"
33556,"Vanessium Sun Fluid with Color SPF50 - 50 ml","D1-18.021","8437024160328",166.75,"VANESSIUM","Care > Sun Care > Sunscreen","images/33556_0.png","-n33556"
33565,"Vanessium Double Care Hyaluronic Acid Cream +SPF50 - 50 ml","D1-18.015","8437024160212",212.75,"VANESSIUM","Care > Sun Care > Sunscreen","images/33565_0.png","-n33565"
11180,"Sunstop Sunscreen Cream With Vitamin E 30SPF - 120ml","D1-02.004","9330490000824",92.58,"Sunstop","Care > Sun Care > Sunscreen","images/11180_0.png","-n11180"
20140,"Laser White Collagen Whitening Sunscreen Cream UV 50+ - 100g","D-16.233","8859362510106,3218362510106",88.09,"Laser White","Care > Sun Care > Sunscreen","images/20140_0.png","-n20140"
27102,"Caribbean Breeze SPF 70 Sunscreen Spray - 156 g","D1-06.014","741927300858",159.00,"Caribbean Breeze","Care > Sun Care > Sunscreen","images/27102_0.png","-n27102"
37669,"Garnier Super UV SPF50+ Invisible Air-Mist Sunscreen - 75ml","D-02.232","3600542631976",41.50,"Garnier","Care > Sun Care > Sunscreen","images/37669_0.jpg","-n37669"
217,"Now Solutions Grapeseed Oil - 118ml","D-02.183","733739147851,733739077059",35.00,"now","Care > Sun Care > Sunscreen","images/217_0.png","-n217"
37674,"Garnier Skinactive Super UV Cooling Gel SPF50 - 30ml","D-02.230","8994993028313",32.77,"Garnier","Care > Sun Care > Sunscreen","images/37674_0.jpg","-n37674"
38658,"K Secret Seoul 1988 Sunscreen Pine Tree + Ceramide - 50ml","D-02.265","8809695240492",56.35,"K-Secret","Care > Sun Care > Sunscreen","images/38658_0.png","-n38658"
40573,"La Roche-Posay Anthelios UVAir Sunscreen Serum SPF 50+ - 50ML","D1-04.017","3337875932349",138.00,"La Roche-Posay","Care > Sun Care > Sunscreen","images/40573_0.jpg","-n40573"
40508,"Medicube PDRN Pink Tone Up Sun Cream - 50ml","D1-01.164","8800256119219",110.00,"Medicube","Care > Sun Care > Sunscreen","images/40508_0.png","-n40508"
35185,"EltaMD UV Clear Broad-Spectrum SPF 46 - 48g","D-07.261","390205025008",270.25,"EltaMD","Care > Sun Care > Sunscreen","images/35185_0.png","-n35185"
39693,"SKIN1004 Madagascar Centella Poremizing Velvet Finish Sunscreen - 50ml","D1-01.070","8809913832485",81.00,"SKIN1004","Care > Sun Care > Sunscreen","images/39693_0.png","-n39693"
40360,"La Roche-Posay Anthelios UVAIR Daily SPF50+ Light Complexion - 50ML","D1-03.033","3337875932301",150.00,"La Roche-Posay","Care > Sun Care > Sunscreen","images/40360_0.png","-n40360"
37662,"LOreal Paris UV Defender Invisible Sunscreen SPF 50+ PA++++ - 50ml","D-02.234","8994993029068",52.00,"LOreal Paris","Care > Sun Care > Sunscreen","images/37662_0.png","-n37662"
40361,"La Roche-Posay Anthelios UVAIR Daily SPF50+ Medium Complexion - 50ML","D1-04.075","3337875932264",150.00,"La Roche-Posay","Care > Sun Care > Sunscreen","images/40361_0.png","-n40361"
36866,"ACM Medisun Cream SPF 100+ - 40ml","D1-15.081","3760095253633",199.00,"ACM","Care > Sun Care > Sunscreen","images/36866_0.png","-n36866"
40511,"Medicube Collagen Firming SunCream - 50ml","D-05.225","8800240576608",99.00,"Medicube","Care > Sun Care > Sunscreen","images/40511_0.png","-n40511"
36859,"Acm Depiwhite.M Protective Cream Spf50+ - 40ml","D-10.070","3760095251899",173.00,"ACM","Care > Sun Care > Sunscreen","images/36859_0.png","-n36859"
40355,"CeraVe Invisible Dry Touch Fluid Sunscreen SPF 50+ - 50ML","D-08.252","3337875945622",110.00,"CeraVe","Care > Sun Care > Sunscreen","images/40355_0.jpg","-n40355"
37816,"Entropy Cool Stick with SPF+50 Body Highlighter","B-19.101","8809908690953",132.25,"Entropy","Care > Sun Care > Sunscreen","images/37816_0.png","-n37816"
38559,"Skin1004 Madagascar Centella Glow 1004 Duo - 2Piecesx50ml","D1-05.042","8809913830344",171.35,"SKIN1004","Care > Sun Care > Sunscreen","images/38559_0.png","-n38559"
40158,"L’Oréal Paris Glycolic Bright UV fluid SPF 50+ PA++++ anti dark spot sunscreen with glycolic acid + niacinamide reduce dark spots - 50ml","D1-01.074","8994993026876",54.00,"LOreal Paris","Care > Sun Care > Sunscreen","images/40158_0.png","-n40158"
40804,"Arencia Cloud Sun Stick - 18g","D1-03.128","8809562192268",65.00,"Arencia","Care > Sun Care > Sunscreen","images/40804_0.png","-n40804"
37374,"TiZO Ultra Zinc Body & Face Non-Tinted SPF40 - 100g","D1-15.057","358892317011",287.50,"TiZO","Care > Sun Care > Sunscreen","images/37374_0.png","-n37374"
40579,"carrot sun Sunscreen cream for kids spf +50 - 60 ml","D1-15.195","5287000375870",57.99,"Carrot Sun","Care > Sun Care > Sunscreen","images/40579_0.png","-n40579"
40880,"Celimax Pore+Dark Spot Brightening Care Sunscreen - 50Ml","D1-06.063","8809971484510",103.01,"Celimax","Care > Sun Care > Sunscreen","images/40880_0.png","-n40880"
40359,"La Roche-Posay Anthelios UVAIR Daily SPF50+ Dark Complexion - 50ML","D1-04.080","3337875932387",150.00,"La Roche-Posay","Care > Sun Care > Sunscreen","images/40359_0.png","-n40359"
37635,"Some By Mi V10 Hyal Air Fit Sunscreen SPF 50 - 50 ml","D1-13.026","8809647393276",124.20,"Some By MI","Care > Sun Care > Sunscreen","images/37635_0.png","-n37635"
38234,"Lanudryou Moisture Sun Cushion Clear +Spf50","D1-05.220","8809783400364",207.00,"Laundryou","Care > Sun Care > Sunscreen","images/38234_0.png","-n38234"
40032,"Biore UV Aqua Rich Watery Gel - 70ml","D1-02.192","4901301413253",110.00,"Biore UV","Care > Sun Care > Sunscreen","images/40032_0.png","-n40032"
40425,"Avaloncare Sunscreen Aquafluid Spf50 - 50ml","D1-04.117","6285095010392",129.00,"Avalon Care","Care > Sun Care > Sunscreen","images/40425_0.png","-n40425"
40580,"carrot sun Sunscreen spf 50+ face cream - 75 ml","D1-15.196","5287000375979",75.00,"Carrot Sun","Care > Sun Care > Sunscreen","images/40580_0.jpg","-n40580"
40581,"carrot sun Sunscreen spf 30+ body milk -130 ml","D1-15.197","5287000375986",109.00,"Carrot Sun","Care > Sun Care > Sunscreen","images/40581_0.png","-n40581"
40803,"Arencia Deep Water Surge Sun Serum - 50ml","D1-04.002","8809562192121",75.00,"Arencia","Care > Sun Care > Sunscreen","images/40803_0.png","-n40803"
41037,"Sinoz Pure Cica Color Correcting Treatment SPF50+ - 50 ML","D-04.120","8681925608797",72.45,"SINOZ","Care > Sun Care > Sunscreen","images/41037_0.png","-n41037"
35189,"EltaMD UV Lip Balm Broad Spectrum SPF 36 - 8g","D1-01.117","390205025107",106.95,"EltaMD","Care > Sun Care > Sunscreen","images/35189_0.png","-n35189"
38700,"Athe Vegan Relief Sun Essence Spf50+Pa++++ - 70ml","D1-09.153","8809786869465",140.00,"ATHE","Care > Sun Care > Sunscreen","images/38700_0.png","-n38700"
38701,"Athe Vegan Relief Tone-Up Sun Bb SPF50+ PA++++- 50ml","D1-09.152","8809786869427",130.00,"ATHE","Care > Sun Care > Sunscreen","images/38701_0.png","-n38701"
38702,"Athe Vegan Relief Sun Cream SPF50+ PA++++ - 40ml","D1-09.151","8809926416405",100.00,"ATHE","Care > Sun Care > Sunscreen","images/38702_0.png","-n38702"
38706,"Athe Lighting Tone Up Sun Cushion  SPF50+ PA++++  - Veggie Green","B1-09.039","8809926417716",132.00,"ATHE","Care > Sun Care > Sunscreen","images/38706_0.png","-n38706"
38707,"Athe Lighting Tone Up Sun Cushion - Rose Petal","B1-09.187","8809926417730",132.00,"ATHE","Care > Sun Care > Sunscreen","images/38707_0.png","-n38707"
38708,"Athe Lighting Tone Up Sun Cushion - Misty Purple","B1-11.165","8809926417723",132.00,"ATHE","Care > Sun Care > Sunscreen","images/38708_0.png","-n38708"
39060,"Zigtag Non-Nano Hyper Shield Sunscreen SPF50+ - 50ml","C-05.072","8809875907405",99.00,"Zigtag","Care > Sun Care > Sunscreen","images/39060_0.png","-n39060"
39397,"bewants skinfit essence moisture sun cream - 50ml","D1-05.088","8809422044508",87.00,"Bewants","Care > Sun Care > Sunscreen","images/39397_0.jpg","-n39397"
39398,"bewants skinfit essence sebum control sun stick 22.5g","D1-05.068","8809422046342",87.00,"Bewants","Care > Sun Care > Sunscreen","images/39398_0.jpg","-n39398"
38044,"Kundal Sunscreen Cream SPF50+ - 50 ml","D1-02.031","8809693257966",85.00,"KUNDAL","Care > Sun Care > Sunscreen","images/38044_0.png","-n38044"
40033,"Biore UV Aqua Rich Light Up Essence  - 70g","D1-02.193","4901301447654",110.00,"Biore UV","Care > Sun Care > Sunscreen","images/40033_0.png","-n40033"
40040,"Dr.Melaxin Hydro Ceramic Glow Light Essence Sun Cream - 50ml","D1-01.057","8809886481918",133.27,"Dr.Melaxin","Care > Sun Care > Sunscreen","images/40040_0.png","-n40040"
40169,"L'Oreal Paris UV Defender AquaFusion SPF Lightweight - 50ml","D1-05.045","8994993029266",54.00,"LOreal Paris","Care > Sun Care > Sunscreen","images/40169_0.png","-n40169"
36615,"Cocosolis Natural Sunscreen Lotion SPF 30 - 100gm","D1-15.004","3800500519326",114.78,"Cocosolis","Care > Sun Care > Sunscreen","images/36615_0.png","-n36615"
36616,"Cocosolis Natural Sunscreen Lotion SPF 50 - 100gm","D1-15.003","3800500519333",114.78,"Cocosolis","Care > Sun Care > Sunscreen","images/36616_0.png","-n36616"
36187,"Tiam B3 Niacin Sunscreen SPF 50+  - 50ml","D1-15.099","8809975191056",120.75,"TIAM","Care > Sun Care > Sunscreen","images/36187_0.png","-n36187"
40354,"CeraVe Invisible Hydrating Fluid Sunscreen SPF50 - 50ML","D-07.272","3337875945660",110.00,"CeraVe","Care > Sun Care > Sunscreen","images/40354_0.jpg","-n40354"
37372,"TiZO 3 Primer Sunscreen Tinted SPF40 PA+++ - 50g","D1-15.059","358892326501",264.50,"TiZO","Care > Sun Care > Sunscreen","images/37372_0.png","-n37372"
37373,"TiZO Photoceutical AM Replenish Lightly Tinted SPF40 - 50 g","D1-15.058","358892101504",264.50,"TiZO","Care > Sun Care > Sunscreen","images/37373_0.png","-n37373"
40557,"Fully Rice Ceramide Moisture Sun Cream - 50ml","D1-04.019","8809567708037",69.00,"Fully","Care > Sun Care > Sunscreen","images/40557_0.png","-n40557"
40583,"Carrot Sun Vanabana Tanning Cream -350ml","D1-15.199","5287000375894",115.00,"Carrot Sun","Care > Sun Care > Sunscreen","images/40583_0.png","-n40583"
40678,"Hajj Sun Care & Protection Kit - 2 Pieces","","5281018088180,3337875797580,3337875797597",242.00,"La Roche-Posay","Care > Sun Care > Sunscreen","images/40678_0.png","-n40678"
